{
  "$schema": "http://json-schema.org/draft-07/schema#",
  "$id": "https://github.com/whieet/harness-kit/templates/config.schema.json",
  "title": "harness-kit project config (.harness/config.json)",
  "description": "Per-project, git-tracked configuration that makes the bundled harness scripts project-agnostic. Every project literal (file globs, verify commands, layering rules, thresholds) lives here, never in plugin code. Normally edited by Claude Code on the user's behalf — see docs/configuration.md for an AI-oriented guide with annotated examples and recipes.",
  "type": "object",
  "properties": {
    "projectType": {
      "type": "string",
      "enum": ["godot", "web", "custom"],
      "description": "Preset identity. Only affects the init scaffolder and advisor copy; the bundled scripts never branch on it.",
      "examples": ["web", "godot", "custom"]
    },
    "verificationMode": {
      "type": "string",
      "enum": ["advisory", "strict"],
      "default": "strict",
      "description": "Stop-gate strictness. strict => a failed gate blocks premature completion (exit 2); advisory => warn only. Overrides the plugin-level userConfig default.",
      "examples": ["strict", "advisory"]
    },
    "verifyCmd": {
      "type": "string",
      "default": "harness-verify",
      "description": "Canonical verify entrypoint, shared by the Stop hook, the git pre-commit hook, and /harness-kit:verify. Defaults to the bundled harness-verify orchestrator that runs gates[].",
      "examples": ["harness-verify"]
    },
    "buildCmd": { "type": "string", "description": "Build/compile command, surfaced by the advisor/checklist.", "examples": ["npm run build", "godot --headless --quit --path ."] },
    "testCmd": { "type": "string", "description": "Test runner command.", "examples": ["npm test -- --run", "godot --headless -s res://tests/run_tests.gd"] },
    "gates": {
      "type": "array",
      "description": "Ordered verification gates run by harness-verify (the Stop gate, pre-commit, and /harness-kit:verify all go through it). Each runs as a shell command; a blocking failure fails the aggregate.",
      "items": {
        "type": "object",
        "required": ["name", "command"],
        "properties": {
          "name": { "type": "string", "description": "Human-readable gate label.", "examples": ["eslint", "typecheck", "layering", "tests"] },
          "command": { "type": "string", "description": "Shell command to run. Bundled gate commands (harness-check-layering, harness-doc-links, harness-doc-gardening, harness-check-plan-dod) resolve via the plugin bin dir, which harness-verify prepends to PATH. Custom gates are any shell command.", "examples": ["npx --no-install eslint .", "harness-check-layering", "npm test -- --run"] },
          "blocking": { "type": "boolean", "default": true, "description": "true = a failure fails the whole verify run. false = soft gate: warns but does not fail the aggregate.", "examples": [true, false] },
          "skipWhenProcess": { "type": "string", "description": "Optional. Skip this gate while a process matching this name is running (e.g. 'Godot' to avoid the editor project lock during a headless compile).", "examples": ["Godot"] },
          "tier": { "type": "string", "enum": ["fast", "full"], "default": "full", "description": "Effort-routing tier. Only relevant when effortRouting.enabled: on low/medium-effort turns only 'fast' gates run (others are logged as skipped). When routing is off (default), tier is ignored and all gates run.", "examples": ["fast", "full"] }
        }
      }
    },
    "layeringRules": {
      "type": "array",
      "description": "Dependency-direction constraints checked by harness-check-layering. Each rule forbids a regex from appearing in files under a glob — i.e. an illegal import/reference across architecture layers.",
      "items": {
        "type": "object",
        "required": ["scope", "forbidden", "message"],
        "properties": {
          "scope": { "type": "string", "description": "Glob of files to check.", "examples": ["src/ui/**/*.{ts,tsx}", "scripts/domain/**/*.gd"] },
          "forbidden": { "type": "string", "description": "Regex that must NOT appear in files under scope (an illegal dependency).", "examples": ["from\\s+['\"][^'\"]*(db|prisma)", "preload\\(\"res://scripts/ui/"] },
          "message": { "type": "string", "description": "Remediation text shown when the rule is violated.", "examples": ["UI must not hit the DB directly; go via an API/service"] }
        }
      }
    },
    "plan": {
      "type": "object",
      "description": "Plan lifecycle convention. Drives the plan gate (auto-scaffold a plan before editing covered code), plan archival on approval, the plan-DoD gate, and advisor counts.",
      "properties": {
        "dir": { "type": "string", "default": "docs/exec-plans", "description": "Plan root; active/ and completed/ live under it.", "examples": ["docs/exec-plans", "docs/plans"] },
        "codeGlob": { "type": "string", "description": "Regex of file paths whose edits require a covering plan. Empty string disables the plan gate.", "examples": ["\\.(ts|tsx)$", "\\.(gd|tscn)$"] },
        "template": { "type": "string", "description": "Path to the plan scaffold template (relative to plugin templates or the project). Defaults to the bundled plan-template.md." },
        "statusField": { "type": "string", "default": "status", "description": "Field label parsed from a plan's frontmatter/header to read its lifecycle status.", "examples": ["status", "状态"] },
        "completedValue": { "type": "string", "default": "completed", "description": "The status value that means a plan is done and must live in completed/." },
        "checklistRegex": { "type": "string", "default": "^- \\[ \\]", "description": "Regex matching an unchecked Definition-of-Done item." },
        "requiredFields": { "type": "array", "items": { "type": "string" }, "description": "Field labels every completed plan must contain (template-compliance check in doc-gardening).", "examples": [["status", "created", "Definition of Done"]] }
      }
    },
    "docs": {
      "type": "object",
      "description": "Doc-related paths. Feed the session handoff (keyDocs), the dead-link scanner (scanRoots), and doc-gardening (architecture/quality/staleness/naming/drift).",
      "properties": {
        "keyDocs": {
          "type": "array",
          "items": { "type": "object", "properties": { "path": { "type": "string" }, "note": { "type": "string" } } },
          "description": "Docs surfaced in the session-start handoff so Claude reads them before related work.",
          "examples": [[{ "path": "ARCHITECTURE.md", "note": "module boundaries" }]]
        },
        "scanRoots": { "type": "array", "items": { "type": "string" }, "default": ["docs"], "description": "Dirs scanned recursively for dead links (top-level *.md is always scanned)." },
        "architecturePath": { "type": "string", "description": "Architecture doc audited for drift by doc-gardening.", "examples": ["ARCHITECTURE.md"] },
        "qualityPath": { "type": "string", "description": "Quality/score doc audited for staleness by doc-gardening.", "examples": ["docs/QUALITY.md"] },
        "stalenessDays": { "type": "integer", "default": 14, "description": "Staleness threshold (days) for the qualityPath newest-date check." },
        "placeholderPatterns": { "type": "array", "items": { "type": "string" }, "description": "Substrings that mark unfinished placeholder docs. Sensible English+CN defaults if omitted.", "examples": [["TODO", "TBD", "待补充"]] },
        "layerPathRegex": { "type": "string", "description": "Regex extracting referenced layer paths from architecturePath; doc-gardening flags any that no longer exist on disk (forward drift).", "examples": ["src/[a-z_-]+"] },
        "layerBaseDir": { "type": "string", "description": "Base dir whose immediate subdirectories are the architecture layers; doc-gardening flags any real subdir NOT declared in architecturePath (reverse drift).", "examples": ["src", "scripts"] },
        "layerIgnoreDirs": { "type": "array", "items": { "type": "string" }, "description": "Subdirectory names under layerBaseDir exempt from the reverse-drift check.", "examples": [["assets", "types", "utils"]] },
        "namingGlob": { "type": "string", "description": "Glob of files whose names are checked against namingDisallow.", "examples": ["src/components/**/*.{ts,tsx}", "scripts/**/*.gd"] },
        "namingDisallow": { "type": "string", "description": "Regex on the basename-without-extension that must NOT match.", "examples": ["[A-Z]", "[ ]"] }
      }
    },
    "metrics": {
      "type": "array",
      "description": "Counted by harness-advisor for its dashboard. Each metric is a glob whose match count is the metric value.",
      "items": {
        "type": "object",
        "required": ["name", "glob"],
        "properties": {
          "name": { "type": "string", "description": "Metric identifier shown on the advisor dashboard.", "examples": ["completed", "components"] },
          "glob": { "type": "string", "description": "Glob whose match count is the metric value.", "examples": ["docs/exec-plans/completed/*.md", "src/components/**/*.{ts,tsx}"] },
          "exclude": { "type": "string", "description": "Optional regex; matching files are excluded from the count.", "examples": ["gitkeep", "_template.md"] }
        }
      }
    },
    "enabledCapabilities": {
      "type": "object",
      "description": "On/off switches for harness behaviors. Absent keys default ON for stable capabilities, OFF for experimental ones. The trace-driven suggester (harness-trace-analyze) recommends toggles; the user decides.",
      "properties": {
        "planGate": { "type": "boolean", "default": true, "description": "Auto-scaffold a plan when editing un-planned code (PreToolUse on Edit/Write)." },
        "loopDetection": { "type": "boolean", "default": true, "description": "Per-file edit-loop nudge (PostToolUse on Edit/Write)." },
        "toolTrace": { "type": "boolean", "default": true, "description": "Record tool-call/failure metadata for trace analysis." },
        "evaluator": { "type": "boolean", "default": true, "description": "RECOMMEND the evaluator at the Stop gate when code changed (a nudge — does NOT auto-run it; see evaluator.enabled to actually run it)." },
        "contextSnapshot": { "type": "boolean", "default": true, "description": "Snapshot harness state before compaction and re-inject it afterward." },
        "evaluatorAutoDispatch": { "type": "boolean", "default": false, "description": "EXPERIMENTAL: auto-run the evaluator subagent via a type:agent Stop hook (non-blocking, context-only). Off by default; also requires wiring hooks/optional-auto-eval.json." }
      }
    },
    "effortRouting": {
      "type": "object",
      "description": "Reasoning-budget routing. When enabled, low/medium-effort turns run only 'fast'-tier gates (skips are logged). Default OFF so verification is never silently weakened by a low-effort turn.",
      "properties": {
        "enabled": { "type": "boolean", "default": false, "description": "Off = always run all gates regardless of effort (safe default). On = route by $CLAUDE_EFFORT." }
      }
    },
    "phases": {
      "type": "array",
      "deprecated": true,
      "description": "DEPRECATED — the maturity-phase auto-router was removed. harness-advisor ignores this key. Use enabledCapabilities{} instead; run harness-maintenance to migrate."
    },
    "loopDetection": {
      "type": "object",
      "description": "Tuning for the per-file edit-loop nudge (independent of the enabledCapabilities.loopDetection on/off switch).",
      "properties": {
        "threshold": { "type": "integer", "default": 5, "description": "Warn after this many edits to one file in a session.", "examples": [5, 8] },
        "ignoreGlobs": { "type": "array", "items": { "type": "string" }, "description": "File globs excluded from loop counting (generated files, lockfiles).", "examples": [["*.lock", "dist/*", "*.import"]] }
      }
    },
    "evaluator": {
      "type": "object",
      "description": "Generator/Evaluator separation, run as the final Stop-gate stage. Distinct from enabledCapabilities.evaluator (which only recommends): set enabled=true here to actually run the skeptical evaluator.",
      "properties": {
        "enabled": { "type": "boolean", "default": false, "description": "Run the skeptical evaluator as the last Stop-hook stage when code matching plan.codeGlob changed." },
        "rubricPath": { "type": "string", "description": "Path to the per-project rubric.", "examples": [".harness/rubric.md"] },
        "mode": { "type": "string", "enum": ["advisory", "strict"], "default": "advisory", "description": "strict => a sub-threshold rubric score blocks completion; advisory => report the score only." }
      }
    },
    "verificationRecipe": {
      "type": "object",
      "description": "Maps each rubric dimension to the verification command / MCP tool that checks it. Consumed by the evaluator agent. Keeps MCP tool names (e.g. play_scene, get_game_screenshot) out of plugin code.",
      "additionalProperties": { "type": "string" },
      "examples": [{ "functionality": "npx playwright test", "quality": "harness-verify" }]
    }
  }
}
